{
  "$schema": "https://json-schema.org/draft/2020-12/schema",
  "type": "object",
  "properties": {
    "id": {
      "type": "string"
    },
    "title": {
      "type": "string"
    },
    "path": {
      "type": "string"
    },
    "upstream": {
      "type": "array",
      "items": {
        "type": "string"
      }
    },
    "checks": {
      "type": "array",
      "minItems": 1
    },
    "inputs": {
      "type": "array"
    },
    "outputs": {
      "type": "array"
    }
  },
  "additionalProperties": false
}
