{
  "id": "A1",
  "title": "问题、愿景与价值",
  "path": "workflow/a_product_intent/a1_problem_vision_value",
  "checks": [
    {
      "id": "A1.1",
      "title": "问题与用户",
      "criterion": "目标用户、现状问题和真实场景有来源；事实、假设、设想分开记录",
      "method": "产物逐项审阅及适用的可执行验证"
    },
    {
      "id": "A1.2",
      "title": "愿景与价值",
      "criterion": "长期愿景、价值主张及成功预期可解释；不把愿景直接承诺为本轮交付",
      "method": "产物逐项审阅及适用的可执行验证"
    },
    {
      "id": "A1.3",
      "title": "理解对账",
      "criterion": "信息缺口及分歧明确，关键理解具有按模式要求的确认来源",
      "method": "产物逐项审阅及适用的可执行验证"
    }
  ],
  "upstream": [],
  "inputs": [
    "当前有效需求及相关上游契约",
    "现状证据和已确认决定"
  ],
  "outputs": [
    "本活动结论及适用产物",
    "清单结果、证据及交接"
  ]
}
