{
  "id": "F2",
  "title": "任务详细设计",
  "path": "workflow/f_delivery_planning/f2_task_details",
  "checks": [
    {
      "id": "F2.1",
      "title": "对象集合",
      "criterion": "任务具体列出受影响接口、方法、数据、配置、文档和测试",
      "method": "产物逐项审阅及适用的可执行验证"
    },
    {
      "id": "F2.2",
      "title": "执行清单",
      "criterion": "任务及方法有检查项、验收条件和验证命令",
      "method": "产物逐项审阅及适用的可执行验证"
    },
    {
      "id": "F2.3",
      "title": "连续性",
      "criterion": "前序任务完成且代码文档索引一致；否则由用户决定继续或回退，禁止新任务",
      "method": "产物逐项审阅及适用的可执行验证"
    }
  ],
  "upstream": [
    "F1"
  ],
  "inputs": [
    "当前有效需求及相关上游契约",
    "现状证据和已确认决定"
  ],
  "outputs": [
    "本活动结论及适用产物",
    "清单结果、证据及交接"
  ]
}
