{
  "id": "B4",
  "title": "整体结构与功能关联",
  "path": "workflow/b_product_design/b4_structure_connections",
  "checks": [
    {
      "id": "B4.1",
      "title": "信息结构",
      "criterion": "全部已纳入功能在结构、导航或调用入口中有位置",
      "method": "产物逐项审阅及适用的可执行验证"
    },
    {
      "id": "B4.2",
      "title": "跨功能关联",
      "criterion": "角色路径、数据传递、状态衔接和返回行为能串联",
      "method": "产物逐项审阅及适用的可执行验证"
    },
    {
      "id": "B4.3",
      "title": "整体演练",
      "criterion": "首次使用、核心成功及失败恢复的完整旅程无断层、死路和权限冲突",
      "method": "产物逐项审阅及适用的可执行验证"
    }
  ],
  "upstream": [
    "B2",
    "B3"
  ],
  "inputs": [
    "当前有效需求及相关上游契约",
    "现状证据和已确认决定"
  ],
  "outputs": [
    "本活动结论及适用产物",
    "清单结果、证据及交接"
  ]
}
