{
  "id": "E7",
  "title": "Mock服务构建",
  "path": "workflow/e_engineering_preparation/e7_mock_services",
  "checks": [
    {
      "id": "E7.1",
      "title": "协议一致",
      "criterion": "无法接入的外部服务按正式HTTP等协议建立独立Mock服务",
      "method": "产物逐项审阅及适用的可执行验证"
    },
    {
      "id": "E7.2",
      "title": "契约验证",
      "criterion": "请求响应、错误、超时等模拟范围有契约测试，未知部分明确标记",
      "method": "产物逐项审阅及适用的可执行验证"
    },
    {
      "id": "E7.3",
      "title": "替换边界",
      "criterion": "客户端只通过配置切换地址，无业务Mock分支；真实接入另做集成验证",
      "method": "产物逐项审阅及适用的可执行验证"
    }
  ],
  "upstream": [
    "E2",
    "E5",
    "E6"
  ],
  "inputs": [
    "当前有效需求及相关上游契约",
    "现状证据和已确认决定"
  ],
  "outputs": [
    "本活动结论及适用产物",
    "清单结果、证据及交接"
  ]
}
