{
  "id": "F4",
  "title": "恢复准备",
  "path": "workflow/f_delivery_planning/f4_recovery_preparation",
  "checks": [
    {
      "id": "F4.1",
      "title": "快照",
      "criterion": "新任务、重大或大量修改前建立文档体系快照并校验",
      "method": "产物逐项审阅及适用的可执行验证"
    },
    {
      "id": "F4.2",
      "title": "变更日志",
      "criterion": "代码配置等全部修改可由changelog和快照共同恢复",
      "method": "产物逐项审阅及适用的可执行验证"
    },
    {
      "id": "F4.3",
      "title": "保留策略",
      "criterion": "快照最多5个且超过48小时清理，引用不悬空，任务同样有淘汰与未完成阻断记录",
      "method": "产物逐项审阅及适用的可执行验证"
    }
  ],
  "upstream": [
    "F3"
  ],
  "inputs": [
    "当前有效需求及相关上游契约",
    "现状证据和已确认决定"
  ],
  "outputs": [
    "本活动结论及适用产物",
    "清单结果、证据及交接"
  ]
}
