{
  "id": "F1",
  "title": "交付切片规划",
  "path": "workflow/f_delivery_planning/f1_delivery_slices",
  "checks": [
    {
      "id": "F1.1",
      "title": "范围分配",
      "criterion": "完整需求分母映射切片；此时才基于功能与可行性安排优先级和分期",
      "method": "产物逐项审阅及适用的可执行验证"
    },
    {
      "id": "F1.2",
      "title": "切片依赖",
      "criterion": "切片围绕业务闭环，上下文紧密，依赖无循环，关键风险先验证",
      "method": "产物逐项审阅及适用的可执行验证"
    },
    {
      "id": "F1.3",
      "title": "完成条件",
      "criterion": "每个切片结果可验证且修改可恢复，无隐含延期",
      "method": "产物逐项审阅及适用的可执行验证"
    }
  ],
  "upstream": [
    "B5",
    "C3",
    "E9"
  ],
  "inputs": [
    "当前有效需求及相关上游契约",
    "现状证据和已确认决定"
  ],
  "outputs": [
    "本活动结论及适用产物",
    "清单结果、证据及交接"
  ]
}
