{
  "id": "H2",
  "title": "交付与恢复验证",
  "path": "workflow/h_delivery_feedback/h2_delivery_recovery_verification",
  "checks": [
    {
      "id": "H2.1",
      "title": "交付可用",
      "criterion": "适用安装、配置、启动和限制说明可操作，完整包可验证",
      "method": "产物逐项审阅及适用的可执行验证"
    },
    {
      "id": "H2.2",
      "title": "恢复演练",
      "criterion": "新增删除移动内容状态及索引都能恢复，后续修改冲突被保护",
      "method": "产物逐项审阅及适用的可执行验证"
    },
    {
      "id": "H2.3",
      "title": "版本证据",
      "criterion": "全部结果对应同一版本，未执行和跳过不记PASS",
      "method": "产物逐项审阅及适用的可执行验证"
    }
  ],
  "upstream": [
    "G4"
  ],
  "inputs": [
    "当前有效需求及相关上游契约",
    "现状证据和已确认决定"
  ],
  "outputs": [
    "本活动结论及适用产物",
    "清单结果、证据及交接"
  ]
}
