{
  "id": "G3",
  "title": "增量集成",
  "path": "workflow/g_implementation_integration/g3_incremental_integration",
  "checks": [
    {
      "id": "G3.1",
      "title": "真实协作",
      "criterion": "数据库、网络、文件及界面等适用边界有集成结果",
      "method": "产物逐项审阅及适用的可执行验证"
    },
    {
      "id": "G3.2",
      "title": "端到端",
      "criterion": "每个业务切片完成后可运行验证，不推迟到最后首次集成",
      "method": "产物逐项审阅及适用的可执行验证"
    },
    {
      "id": "G3.3",
      "title": "回归",
      "criterion": "受影响调用链、任务和方法的回归测试覆盖且通过",
      "method": "产物逐项审阅及适用的可执行验证"
    }
  ],
  "upstream": [
    "G2"
  ],
  "inputs": [
    "当前有效需求及相关上游契约",
    "现状证据和已确认决定"
  ],
  "outputs": [
    "本活动结论及适用产物",
    "清单结果、证据及交接"
  ]
}
