{
  "id": "D2",
  "title": "结构与协作设计",
  "path": "workflow/d_architecture/d2_structure_collaboration",
  "checks": [
    {
      "id": "D2.1",
      "title": "依赖方向",
      "criterion": "模块依赖和接口明确，核心逻辑不依赖Mock与可选追踪实现",
      "method": "产物逐项审阅及适用的可执行验证"
    },
    {
      "id": "D2.2",
      "title": "运行视图",
      "criterion": "成功、失败场景映射到调用、数据流和进程协作；不是只画目录树",
      "method": "产物逐项审阅及适用的可执行验证"
    },
    {
      "id": "D2.3",
      "title": "部署视图",
      "criterion": "部署、启动、配置与外部依赖关系能解释并演练",
      "method": "产物逐项审阅及适用的可执行验证"
    }
  ],
  "upstream": [
    "D1"
  ],
  "inputs": [
    "当前有效需求及相关上游契约",
    "现状证据和已确认决定"
  ],
  "outputs": [
    "本活动结论及适用产物",
    "清单结果、证据及交接"
  ]
}
