{
  "id": "A2",
  "title": "定位与产品调性",
  "path": "workflow/a_product_intent/a2_positioning_product_character",
  "checks": [
    {
      "id": "A2.1",
      "title": "竞品与替代",
      "criterion": "竞品及替代方案的结论绑定来源和时间；没有调研时明确未知",
      "method": "产物逐项审阅及适用的可执行验证"
    },
    {
      "id": "A2.2",
      "title": "产品定位",
      "criterion": "受众、用途、差异化和适用边界一致，不凭竞品增加功能",
      "method": "产物逐项审阅及适用的可执行验证"
    },
    {
      "id": "A2.3",
      "title": "产品调性",
      "criterion": "体验、语言、信息密度和审美原则具体；宏观原则不混入组件细节",
      "method": "产物逐项审阅及适用的可执行验证"
    }
  ],
  "upstream": [
    "A1"
  ],
  "inputs": [
    "当前有效需求及相关上游契约",
    "现状证据和已确认决定"
  ],
  "outputs": [
    "本活动结论及适用产物",
    "清单结果、证据及交接"
  ]
}
