{
  "id": "E3",
  "title": "方法与组件设计",
  "path": "workflow/e_engineering_preparation/e3_method_component_contracts",
  "checks": [
    {
      "id": "E3.1",
      "title": "方法详情",
      "criterion": "关键方法职责、签名、前后置条件、不变量、副作用和依赖明确",
      "method": "产物逐项审阅及适用的可执行验证"
    },
    {
      "id": "E3.2",
      "title": "复用判断",
      "criterion": "写前按意图与契约检索已有方法；不能仅凭相似度强制复用",
      "method": "产物逐项审阅及适用的可执行验证"
    },
    {
      "id": "E3.3",
      "title": "可测与定位",
      "criterion": "设计关联代码符号和测试；简单私有方法允许由调用链覆盖但不能遗漏",
      "method": "产物逐项审阅及适用的可执行验证"
    }
  ],
  "upstream": [
    "E2",
    "D2"
  ],
  "inputs": [
    "当前有效需求及相关上游契约",
    "现状证据和已确认决定"
  ],
  "outputs": [
    "本活动结论及适用产物",
    "清单结果、证据及交接"
  ]
}
