{
  "id": "G4",
  "title": "一致性提交",
  "path": "workflow/g_implementation_integration/g4_consistent_commit",
  "checks": [
    {
      "id": "G4.1",
      "title": "四层一致",
      "criterion": "内存缓存、索引文档、内容文档和代码属于同一有效修订",
      "method": "产物逐项审阅及适用的可执行验证"
    },
    {
      "id": "G4.2",
      "title": "提交协议",
      "criterion": "先登记修改，再验证、发布索引、失效缓存，最后标记提交完成",
      "method": "产物逐项审阅及适用的可执行验证"
    },
    {
      "id": "G4.3",
      "title": "中断回滚",
      "criterion": "提交中断可识别、可恢复，回滚全部修改并核验摘要及行为",
      "method": "产物逐项审阅及适用的可执行验证"
    }
  ],
  "upstream": [
    "G3"
  ],
  "inputs": [
    "当前有效需求及相关上游契约",
    "现状证据和已确认决定"
  ],
  "outputs": [
    "本活动结论及适用产物",
    "清单结果、证据及交接"
  ]
}
