{
  "id": "E5",
  "title": "测试用例构建",
  "path": "workflow/e_engineering_preparation/e5_test_cases",
  "checks": [
    {
      "id": "E5.1",
      "title": "用例构建",
      "criterion": "需求、契约、边界、异常及质量风险对应输入、预期和断言",
      "method": "产物逐项审阅及适用的可执行验证"
    },
    {
      "id": "E5.2",
      "title": "实际测试",
      "criterion": "适用测试可执行，缺失业务实现与环境损坏可区分",
      "method": "产物逐项审阅及适用的可执行验证"
    },
    {
      "id": "E5.3",
      "title": "覆盖映射",
      "criterion": "任务和受影响方法都在清单中并有直接或间接测试依据",
      "method": "产物逐项审阅及适用的可执行验证"
    }
  ],
  "upstream": [
    "B5",
    "E1",
    "E2",
    "E3",
    "E4"
  ],
  "inputs": [
    "当前有效需求及相关上游契约",
    "现状证据和已确认决定"
  ],
  "outputs": [
    "本活动结论及适用产物",
    "清单结果、证据及交接"
  ]
}
