{
  "id": "D1",
  "title": "领域与职责划分",
  "path": "workflow/d_architecture/d1_domain_responsibilities",
  "checks": [
    {
      "id": "D1.1",
      "title": "统一语言",
      "criterion": "术语、业务边界及实体含义一致；复杂领域按需进行DDD建模",
      "method": "产物逐项审阅及适用的可执行验证"
    },
    {
      "id": "D1.2",
      "title": "职责归属",
      "criterion": "模块职责和数据所有权无关键遗漏或重叠",
      "method": "产物逐项审阅及适用的可执行验证"
    },
    {
      "id": "D1.3",
      "title": "内聚边界",
      "criterion": "共同变化的逻辑集中，不同变化原因隔离，公共接口隐藏内部细节",
      "method": "产物逐项审阅及适用的可执行验证"
    }
  ],
  "upstream": [
    "B2",
    "C3"
  ],
  "inputs": [
    "当前有效需求及相关上游契约",
    "现状证据和已确认决定"
  ],
  "outputs": [
    "本活动结论及适用产物",
    "清单结果、证据及交接"
  ]
}
