{
  "id": "B2",
  "title": "逐功能行为设计",
  "path": "workflow/b_product_design/b2_feature_behavior",
  "checks": [
    {
      "id": "B2.1",
      "title": "功能契约",
      "criterion": "每个功能明确前置条件、输入输出、后置条件和副作用",
      "method": "产物逐项审阅及适用的可执行验证"
    },
    {
      "id": "B2.2",
      "title": "业务规则",
      "criterion": "角色、权限、状态、不变量及数据归属清楚，规则没有冲突",
      "method": "产物逐项审阅及适用的可执行验证"
    },
    {
      "id": "B2.3",
      "title": "异常场景",
      "criterion": "正常、拒绝、边界、重复操作及异常恢复均有可观察结果",
      "method": "产物逐项审阅及适用的可执行验证"
    }
  ],
  "upstream": [
    "B1"
  ],
  "inputs": [
    "当前有效需求及相关上游契约",
    "现状证据和已确认决定"
  ],
  "outputs": [
    "本活动结论及适用产物",
    "清单结果、证据及交接"
  ]
}
