{
  "id": "H1",
  "title": "完整性对账与现状核验",
  "path": "workflow/h_delivery_feedback/h1_coverage_review",
  "checks": [
    {
      "id": "H1.1",
      "title": "事实基线",
      "criterion": "修复重构先阅读实际代码及证据；区别需求、缺陷和偶然行为",
      "method": "产物逐项审阅及适用的可执行验证"
    },
    {
      "id": "H1.2",
      "title": "完整覆盖",
      "criterion": "需求功能设计任务方法测试及证据无未解释遗漏或孤立项",
      "method": "产物逐项审阅及适用的可执行验证"
    },
    {
      "id": "H1.3",
      "title": "一致性",
      "criterion": "代码文档索引缓存版本及契约一致，旧确认没有被错误沿用",
      "method": "产物逐项审阅及适用的可执行验证"
    }
  ],
  "upstream": [],
  "inputs": [
    "当前有效需求及相关上游契约",
    "现状证据和已确认决定"
  ],
  "outputs": [
    "本活动结论及适用产物",
    "清单结果、证据及交接"
  ]
}
