{
  "id": "F3",
  "title": "上下文装配",
  "path": "workflow/f_delivery_planning/f3_context_assembly",
  "checks": [
    {
      "id": "F3.1",
      "title": "活跃工作集",
      "criterion": "当前目标、有效约束、契约、修改内容、未决项和验收条件集中",
      "method": "产物逐项审阅及适用的可执行验证"
    },
    {
      "id": "F3.2",
      "title": "冷热分离",
      "criterion": "历史讨论和完整输出只保留引用；频繁读写数据拆小常驻",
      "method": "产物逐项审阅及适用的可执行验证"
    },
    {
      "id": "F3.3",
      "title": "完整性",
      "criterion": "上下文有源版本和摘要，预算内保持必要依赖，不为缩短而丢失约束",
      "method": "产物逐项审阅及适用的可执行验证"
    }
  ],
  "upstream": [
    "F2"
  ],
  "inputs": [
    "当前有效需求及相关上游契约",
    "现状证据和已确认决定"
  ],
  "outputs": [
    "本活动结论及适用产物",
    "清单结果、证据及交接"
  ]
}
