{
  "id": "B1",
  "title": "完整功能提取",
  "path": "workflow/b_product_design/b1_feature_inventory",
  "checks": [
    {
      "id": "B1.1",
      "title": "业务功能",
      "criterion": "宏观能力拆为稳定功能ID，逐项标明需求来源和适用角色",
      "method": "产物逐项审阅及适用的可执行验证"
    },
    {
      "id": "B1.2",
      "title": "通用能力",
      "criterion": "登录、注册、用户信息、权限、列表、搜索、分页、导航等逐项决定纳入、排除或待定并说明依据",
      "method": "产物逐项审阅及适用的可执行验证"
    },
    {
      "id": "B1.3",
      "title": "功能基线",
      "criterion": "本轮已知功能完整列出；关键待定项解决后才设计依赖它的详细流程",
      "method": "产物逐项审阅及适用的可执行验证"
    }
  ],
  "upstream": [
    "A3"
  ],
  "inputs": [
    "当前有效需求及相关上游契约",
    "现状证据和已确认决定"
  ],
  "outputs": [
    "本活动结论及适用产物",
    "清单结果、证据及交接"
  ]
}
